{
  "schema_version": "1",
  "oracle_epoch": 2,
  "record_kind": "alignment",
  "record_key": "call-w-q01acbd4cee56dd64-tbad996453287e5a7-d0-r5-s0-si000003-ir00-ts00000512-cl00000069",
  "workload": {
    "key": "w-q01acbd4cee56dd64-tbad996453287e5a7-d0-r5-s0",
    "query_digest_fnv1a64": "01acbd4cee56dd64",
    "target_digest_fnv1a64": "bad996453287e5a7",
    "query_length": 1907,
    "target_length": 2501,
    "dna_start": 0,
    "rule": 5,
    "strand": 0
  },
  "attempt": {
    "key": "call-w-q01acbd4cee56dd64-tbad996453287e5a7-d0-r5-s0-si000003-ir00-ts00000512-cl00000069",
    "scoreinfo_index": 3,
    "prealign_score": 72,
    "identity_round": 0,
    "identity_ppm": 600000,
    "target_start": 512,
    "cutlength": 69,
    "selected": true,
    "selection_reason": "best_fallback"
  },
  "input": {
    "query_digest_fnv1a64": "01acbd4cee56dd64",
    "reference_digest_fnv1a64": "101c42f62ac83b80",
    "query_length": 1907,
    "reference_length": 69
  },
  "scoring": {
    "match": 5,
    "mismatch_penalty": 4,
    "gap_open": 16,
    "gap_extend": 4,
    "mask_len": 15,
    "flag": 15,
    "score_filter": 0,
    "distance_filter": 32767
  },
  "status": "complete",
  "failure_reason": "none",
  "final_numeric_path": "byte8",
  "dp_passes": [
    {
      "stage": "forward",
      "numeric_path": "byte8",
      "ref_direction": 0,
      "column_count": 69,
      "column_max_digest_fnv1a64": "c9e346325176bb75",
      "maximum_score": 68,
      "best_score": 68,
      "best_ref": 68,
      "best_read": 1751,
      "second_score": 60,
      "second_ref": 52,
      "columns": [5, 10, 15, 20, 25, 30, 35, 31, 30, 32, 30, 35, 31, 36, 32, 33, 34, 39, 39, 44, 40, 41, 46, 42, 38, 38, 39, 44, 40, 45, 50, 55, 51, 49, 54, 59, 55, 55, 51, 49, 49, 54, 50, 51, 56, 52, 57, 53, 49, 49, 50, 55, 60, 65, 61, 57, 53, 55, 51, 49, 47, 52, 57, 54, 50, 53, 58, 63, 68]
    },
    {
      "stage": "reverse",
      "numeric_path": "byte8",
      "ref_direction": 1,
      "column_count": 69,
      "column_max_digest_fnv1a64": "d897d3e937f8e2ad",
      "maximum_score": 68,
      "best_score": 68,
      "best_ref": 12,
      "best_read": 55,
      "second_score": 45,
      "second_ref": 31,
      "columns": [0, 0, 0, 0, 0, 0, 0, 0, 0, 0, 0, 0, 68, 63, 58, 53, 48, 43, 38, 42, 42, 46, 41, 36, 35, 39, 41, 38, 42, 44, 41, 45, 40, 35, 39, 34, 33, 37, 41, 45, 40, 36, 39, 35, 39, 43, 39, 42, 40, 41, 44, 41, 36, 31, 34, 34, 33, 37, 32, 36, 31, 31, 35, 30, 25, 20, 15, 10, 5]
    }
  ],
  "forward_endpoint": {
    "score1": 68,
    "score2": 60,
    "ref_end1": 68,
    "read_end1": 1751,
    "ref_end2": 52
  },
  "reverse_start": {
    "ref_begin1": 12,
    "read_begin1": 1696
  },
  "band_history": [
    {"band_width": 2, "maximum_score": 68, "target_score": 68}
  ],
  "traceback": {
    "stop_rule": "read_index_reaches_zero_then_force_terminal_match",
    "cigar": "20M1I4M2D31M",
    "cigar_operation_count": 5,
    "cigar_digest_fnv1a64": "18ff49cf85ea788a"
  },
  "emitted_rows": [
    {
      "row_contract": "triplex_l6_v1",
      "query_start": 1697,
      "query_end": 1752,
      "target_start": 525,
      "target_end": 581,
      "direction": "R",
      "strand": 0,
      "reverse": 1,
      "rule": 5,
      "score": 68,
      "nt": 58,
      "mean_identity": 62.0689659,
      "mean_stability": 2.45689607,
      "aligned_tfo": "TGCCTCAGCCCACACCAGCTCTCCT--GTAACCCACTGACTTTGTAAACGCTTTCTTC",
      "aligned_tts": "ATGCAGATGGCAAAGGGTGA-AGGAGGTATAGGGTGGAAGAAAAGTAAACAAAAGAAC",
      "ungapped_tfo": "TGCCTCAGCCCACACCAGCTCTCCTGTAACCCACTGACTTTGTAAACGCTTTCTTC",
      "ungapped_tts": "ATGCAGATGGCAAAGGGTGAAGGAGGTATAGGGTGGAAGAAAAGTAAACAAAAGAAC",
      "row_digest_fnv1a64": "52515766f312ed1a"
    }
  ]
}
